{
  "schema": "stegverse.mindforge-boundary-semantics.canonical-execution-evidence.v1",
  "suite_id": "mindforge-boundary-semantics-v1",
  "repository": "Data-Continuation/formalism-tests",
  "commit_sha": "8d8cf3cdd99050afdba9b64ad3eca46b9babe13e",
  "execution_surface": "GITHUB_ACTIONS",
  "run_id": 40967795588,
  "commands": [
    "python tools/run_declared_tasks.py tools/tasks/mindforge_boundary_semantics_tasks.json --task-id mindforge_boundary_semantics_tests",
    "python tools/run_declared_tasks.py tools/tasks/mindforge_boundary_semantics_tasks.json --task-id verify_mindforge_boundary_semantics_artifacts",
    "python tools/run_declared_tasks.py tools/tasks/mindforge_boundary_semantics_tasks.json --task-id check_mindforge_boundary_semantics_canonical_evidence_gate"
  ],
  "task_results": {
    "mindforge_boundary_semantics_tests": "PASS",
    "verify_mindforge_boundary_semantics_artifacts": "PASS",
    "check_mindforge_boundary_semantics_canonical_evidence_gate": "PASS"
  },
  "artifact_hashes": {
    "report_sha256": "8ddbf8dde7db67f1bfae3742fabbd7cec01d5dd85e4d073e8f42cfd1cee75cc2",
    "receipts_sha256": "61e1dcda0a257db2083c7e904b90a714a3f7f048a2a1ec2d6d05bf4a70b0647c",
    "expected_outcomes_sha256": "47436bce4048079c7bae0bcd51efbd59206b6d6be602ac78d73ca48766f51fc6",
    "artifact_verification_sha256": "83e63482e0cf6e703ca7669223846a5c47868b274f7d0fc030c7531791154d3e"
  },
  "artifact_equivalence": {
    "report_receipt_equivalence": true,
    "expected_outcome_equivalence": true,
    "no_execution_invoked": true
  },
  "status": "VERIFIED_CANONICAL_RUN",
  "authority_posture": "ARCHITECTURAL_BOUNDARY_SEMANTICS_ONLY"
}
